{"supplier_id": "cj-eu-warehouse-01", "supplier_name": "CJ Dropshipping Germany Warehouse (Frankfurt)", "platform": "cjdropshipping", "warehouse_country": "DE", "origin_country": "CN", "reliability_rating": 4.7, "dispute_rate_percent": 1.5, "typical_lead_days": {"processing_days": 2, "shipping_min_days": 2, "shipping_max_days": 5}, "shipping_tiers": [{"carrier": "DHL", "service_name": "DHL Paket Domestic", "base_cost": 5.2, "currency": "EUR", "tracked": true}, {"carrier": "Hermes", "service_name": "Hermes Standard", "base_cost": 4.6, "currency": "EUR", "tracked": true}], "eu_anti_deminimis_ready": true, "us_domestic_stock": false, "score": {"total": 88.8, "fulfillment_speed": 100.0, "cost_competitiveness": 70.8, "reliability": 84.4, "compliance": 100.0}, "notes": "EU warehouse; bypasses the 1 July 2026 EUR 3 flat import duty on China direct imports.", "updated_at": "2026-09-01T14:41:08.800245+00:00"}