{"supplier_id": "cj-us-warehouse-01", "supplier_name": "CJ Dropshipping US East Warehouse (NJ/CA)", "platform": "cjdropshipping", "warehouse_country": "US", "origin_country": "CN", "reliability_rating": 4.8, "dispute_rate_percent": 1.2, "typical_lead_days": {"processing_days": 1, "shipping_min_days": 3, "shipping_max_days": 6}, "shipping_tiers": [{"carrier": "USPS", "service_name": "USPS Ground Advantage", "base_cost": 4.85, "currency": "USD", "tracked": true}, {"carrier": "USPS", "service_name": "Priority Mail", "base_cost": 8.95, "currency": "USD", "tracked": true}], "eu_anti_deminimis_ready": false, "us_domestic_stock": true, "score": {"total": 85.7, "fulfillment_speed": 100.0, "cost_competitiveness": 54.8, "reliability": 88.0, "compliance": 100.0}, "notes": "US domestic inventory; avoids international customs and de minimis fees.", "updated_at": "2026-09-01T14:41:08.652508+00:00"}